[
  {
    "rank": 1,
    "title": "Gaylord Opryland Resort & Convention Center",
    "brand": "Gaylord Hotels",
    "location": {
      "address": "2800 Opryland Drive, Nashville, TN 37214",
      "city": "Nashville",
      "state": "TN",
      "postal_code": "37214",
      "coordinates": {
        "lat": 36.211446,
        "lng": -86.694456
      }
    },
    "value": "2,888 rooms",
    "size": {
      "total_guest_rooms": 2888,
      "suites": 171,
      "ranking_metric": "total_guest_rooms"
    },
    "nightly_price": null,
    "building": {
      "floors": null,
      "year_opened": 1977,
      "year_built": null,
      "last_renovated": null,
      "building_square_feet": null,
      "meeting_space_square_feet": 700000
    },
    "history": [
      "Opened with 578 rooms in 1977; the 1996 Delta Atrium expansion increased the resort to its current 2,888 rooms."
    ],
    "sources": [
      {
        "url": "https://www.marriott.com/en-us/hotels/bnago-gaylord-opryland-resort-and-convention-center/overview/",
        "publisher": "Marriott International",
        "supports": [
          "name",
          "brand",
          "address",
          "operating status",
          "room count",
          "suite count"
        ],
        "verified_at": "2026-07-21"
      },
      {
        "url": "https://www.gaylordhotels.com/meet/compare-properties",
        "publisher": "Gaylord Hotels",
        "supports": [
          "room count",
          "meeting space"
        ],
        "verified_at": "2026-07-21"
      },
      {
        "url": "https://www.gaylordhotels.com/about-us/our-legacy",
        "publisher": "Gaylord Hotels",
        "supports": [
          "year opened",
          "expansion history"
        ],
        "verified_at": "2026-07-21"
      },
      {
        "url": "https://maps.apple.com/place?coordinate=36.21144604989278%2C-86.69445633888245&name=Gaylord+Opryland+Resort+%26+Convention+Center",
        "publisher": "Apple Maps",
        "supports": [
          "coordinates"
        ],
        "note": "Property point for the verified street address.",
        "verified_at": "2026-07-21"
      }
    ],
    "verified_at": "2026-07-21"
  },
  {
    "rank": 2,
    "title": "Orlando World Center Marriott",
    "brand": "Marriott Hotels",
    "location": {
      "address": "8701 World Center Drive, Orlando, FL 32821",
      "city": "Orlando",
      "state": "FL",
      "postal_code": "32821",
      "coordinates": {
        "lat": 28.360547,
        "lng": -81.509141
      }
    },
    "value": "2,010 rooms",
    "size": {
      "total_guest_rooms": 2010,
      "suites": 121,
      "ranking_metric": "total_guest_rooms"
    },
    "nightly_price": null,
    "building": {
      "floors": 28,
      "year_opened": 1986,
      "year_built": null,
      "last_renovated": 2021,
      "building_square_feet": 1300000,
      "meeting_space_square_feet": 490500
    },
    "history": [
      "A 500-room tower completed in 2002 made the property the world's largest Marriott at that time."
    ],
    "sources": [
      {
        "url": "https://www.marriott.com/en-us/hotels/mcowc-orlando-world-center-marriott/overview/",
        "publisher": "Marriott International",
        "supports": [
          "name",
          "brand",
          "address",
          "operating status",
          "room count"
        ],
        "verified_at": "2026-07-21"
      },
      {
        "url": "https://www.hosthotels.com/Properties/Domestic/Florida/Orlando-World-Center-Marriott",
        "publisher": "Host Hotels & Resorts",
        "supports": [
          "suite count",
          "meeting space",
          "renovation year"
        ],
        "note": "The owner page reports a slightly lower 2,004-room inventory; Marriott's current consumer page is used for ranking.",
        "verified_at": "2026-07-21"
      },
      {
        "url": "https://en.wikipedia.org/wiki/Orlando_World_Center_Marriott",
        "publisher": "Wikipedia contributors",
        "supports": [
          "year opened",
          "floors",
          "building square footage",
          "expansion history"
        ],
        "verified_at": "2026-07-21"
      },
      {
        "url": "https://geocoding.geo.census.gov/geocoder/geographies/addressbatch",
        "publisher": "U.S. Census Bureau",
        "supports": [
          "coordinates"
        ],
        "note": "Batch geocoder exact match for the verified address.",
        "verified_at": "2026-07-21"
      }
    ],
    "verified_at": "2026-07-21"
  },
  {
    "rank": 3,
    "title": "Gaylord National Resort & Convention Center",
    "brand": "Gaylord Hotels",
    "location": {
      "address": "201 Waterfront Street, National Harbor, MD 20745",
      "city": "National Harbor",
      "state": "MD",
      "postal_code": "20745",
      "coordinates": {
        "lat": 38.78334,
        "lng": -77.017348
      }
    },
    "value": "1,996 rooms",
    "size": {
      "total_guest_rooms": 1996,
      "suites": 110,
      "ranking_metric": "total_guest_rooms"
    },
    "nightly_price": null,
    "building": {
      "floors": 19,
      "year_opened": 2008,
      "year_built": null,
      "last_renovated": null,
      "building_square_feet": null,
      "meeting_space_square_feet": 545000
    },
    "history": [
      "The resort had more than 1.3 million room nights booked before its April 2008 opening."
    ],
    "sources": [
      {
        "url": "https://www.marriott.com/en-us/hotels/wasgn-gaylord-national-resort-and-convention-center/overview/",
        "publisher": "Marriott International",
        "supports": [
          "name",
          "brand",
          "address",
          "operating status"
        ],
        "verified_at": "2026-07-21"
      },
      {
        "url": "https://www.marriott.com/content/dam/marriott-digital/ge/us-canada/hws/w/wasgn/en_us/document/assets/ge-wasgn-wasgn-quickfacts-april21-32034.pdf",
        "publisher": "Marriott International",
        "supports": [
          "room count",
          "suite count",
          "meeting space"
        ],
        "verified_at": "2026-07-21"
      },
      {
        "url": "https://en.wikipedia.org/wiki/Gaylord_National_Resort_%26_Convention_Center",
        "publisher": "Wikipedia contributors",
        "supports": [
          "year opened",
          "floors",
          "booking history"
        ],
        "verified_at": "2026-07-21"
      },
      {
        "url": "https://geocoding.geo.census.gov/geocoder/geographies/addressbatch",
        "publisher": "U.S. Census Bureau",
        "supports": [
          "coordinates"
        ],
        "note": "Batch geocoder exact match for the verified address.",
        "verified_at": "2026-07-21"
      }
    ],
    "verified_at": "2026-07-21"
  },
  {
    "rank": 4,
    "title": "New York Marriott Marquis",
    "brand": "Marriott Hotels",
    "location": {
      "address": "1535 Broadway, New York, NY 10036",
      "city": "New York",
      "state": "NY",
      "postal_code": "10036",
      "coordinates": {
        "lat": 40.75829,
        "lng": -73.985526
      }
    },
    "value": "1,966 rooms",
    "size": {
      "total_guest_rooms": 1966,
      "suites": null,
      "ranking_metric": "total_guest_rooms"
    },
    "nightly_price": null,
    "building": {
      "floors": 51,
      "year_opened": 1985,
      "year_built": null,
      "last_renovated": null,
      "building_square_feet": null,
      "meeting_space_square_feet": 101000
    },
    "history": [
      "The John Portman-designed Times Square hotel opened on September 3, 1985 after plans dating to the early 1970s."
    ],
    "sources": [
      {
        "url": "https://www.marriott.com/en-us/hotels/nycmq-new-york-marriott-marquis/overview/",
        "publisher": "Marriott International",
        "supports": [
          "name",
          "brand",
          "address",
          "operating status"
        ],
        "verified_at": "2026-07-21"
      },
      {
        "url": "https://www.hosthotels.com/properties/domestic/new-york/new-york-marriott-marquis",
        "publisher": "Host Hotels & Resorts",
        "supports": [
          "room count",
          "meeting space"
        ],
        "verified_at": "2026-07-21"
      },
      {
        "url": "https://en.wikipedia.org/wiki/New_York_Marriott_Marquis",
        "publisher": "Wikipedia contributors",
        "supports": [
          "year opened",
          "floors",
          "history"
        ],
        "verified_at": "2026-07-21"
      },
      {
        "url": "https://geocoding.geo.census.gov/geocoder/geographies/addressbatch",
        "publisher": "U.S. Census Bureau",
        "supports": [
          "coordinates"
        ],
        "note": "Batch geocoder exact match for the verified address.",
        "verified_at": "2026-07-21"
      }
    ],
    "verified_at": "2026-07-21"
  },
  {
    "rank": 5,
    "title": "Sheraton Dallas Hotel",
    "brand": "Sheraton",
    "location": {
      "address": "400 North Olive Street, Dallas, TX 75201",
      "city": "Dallas",
      "state": "TX",
      "postal_code": "75201",
      "coordinates": {
        "lat": 32.784375,
        "lng": -96.79451
      }
    },
    "value": "1,841 rooms",
    "size": {
      "total_guest_rooms": 1841,
      "suites": null,
      "ranking_metric": "total_guest_rooms"
    },
    "nightly_price": null,
    "building": {
      "floors": 42,
      "year_opened": 1959,
      "year_built": null,
      "last_renovated": null,
      "building_square_feet": null,
      "meeting_space_square_feet": 230000
    },
    "history": [
      "The complex opened as the Southland Center and later operated as an Adam's Mark before becoming the Sheraton Dallas."
    ],
    "sources": [
      {
        "url": "https://www.marriott.com/en-us/hotels/daldh-sheraton-dallas-hotel/overview/",
        "publisher": "Marriott International",
        "supports": [
          "name",
          "brand",
          "address",